{"$schema":"https://json-schema.org/draft/2020-12/schema","type":"object","additionalProperties":false,"required":["research_id","question","as_of_date","transaction_date","jurisdiction","topics","facts","sources_considered","primary_sources","official_guidance","secondary_sources","relevant_provisions","facts_required","interpretation","uncertainties","conflicting_sources","candidate_conclusion","confidence","human_review_required","confidence_basis","snapshot_hash","snapshot_schema_version","court_sources"],"properties":{"research_id":{"type":"string"},"question":{"type":"string"},"as_of_date":{"type":"string","format":"date"},"transaction_date":{"type":"string","format":"date"},"jurisdiction":{"type":"array","items":{"enum":["HU","EU","NON_EU"]}},"topics":{"type":"array","items":{"type":"string"}},"facts":{"type":"object"},"sources_considered":{"type":"array","items":{"$ref":"#/$defs/source"}},"primary_sources":{"type":"array","items":{"type":"string"}},"official_guidance":{"type":"array","items":{"type":"string"}},"secondary_sources":{"type":"array","items":{"type":"string"}},"relevant_provisions":{"type":"array","items":{"type":"object","additionalProperties":false,"required":["source_id","provision","version_date","summary","applicability_notes","verified"],"properties":{"source_id":{"type":"string"},"provision":{"type":"string"},"article":{"type":["string","null"]},"paragraph":{"type":["string","null"]},"version_date":{"type":["string","null"]},"summary":{"type":"string"},"applicability_notes":{"type":"string"},"verified":{"type":"boolean"}}}},"facts_required":{"type":"array","items":{"type":"string"}},"interpretation":{"type":"string"},"uncertainties":{"type":"array","items":{"type":"string"}},"conflicting_sources":{"type":"array","items":{"type":"string"}},"candidate_conclusion":{"type":"string"},"confidence":{"enum":["high","medium","low"]},"human_review_required":{"const":true},"confidence_basis":{"type":"array","items":{"type":"string"}},"snapshot_hash":{"type":"string"},"snapshot_schema_version":{"const":"1.3.0"},"court_sources":{"type":"array","items":{"type":"string"}},"exceptions_modeled":{"type":"array","items":{"type":"string"}}},"$defs":{"source":{"type":"object","additionalProperties":false,"required":["source_id","verification","title","official_url","source_type","authority_level","version_date","publication_date","retrieved_at","effective_from","effective_to"],"properties":{"source_id":{"type":"string"},"verification":{"type":"object","additionalProperties":false,"required":["state","url_reachable","content_accessed","content_verified","effective_date_verified","applicability_verified","checked_at","notes"],"properties":{"state":{"enum":["DISCOVERED","URL_REACHABLE","CONTENT_ACCESSED","CONTENT_VERIFIED","EFFECTIVE_DATE_VERIFIED","APPLICABILITY_VERIFIED","SOURCE_NOT_VERIFIED"]},"url_reachable":{"type":"boolean"},"content_accessed":{"type":"boolean"},"content_verified":{"type":"boolean"},"effective_date_verified":{"type":"boolean"},"applicability_verified":{"type":"boolean"},"checked_at":{"type":["string","null"],"format":"date-time"},"notes":{"type":"string"}}},"title":{"type":"string"},"official_url":{"type":"string"},"source_type":{"type":"string"},"authority_level":{"enum":["primary","official_guidance","court_authority","official_operational","provider","secondary"]},"version_date":{"type":["string","null"],"format":"date"},"publication_date":{"type":["string","null"],"format":"date"},"retrieved_at":{"type":["string","null"],"format":"date"},"effective_from":{"type":["string","null"],"format":"date"},"effective_to":{"type":["string","null"],"format":"date"}}}}}
