{
  "as_of_date": "2026-10-08",
  "candidate_conclusion": "Rule text researched for a narrowly gated proposal; this research is not a tax conclusion.",
  "confidence": "medium",
  "confidence_basis": [
    "Fresh official-source content reviewed on 2026-10-08; verification is source-specific and does not decide applicability to a real transaction."
  ],
  "conflicting_sources": [],
  "court_sources": [],
  "facts": {
    "research_phase": "4.5",
    "scope": "synthetic narrow general-service rules; no CareGrid classification"
  },
  "facts_required": [
    "customer is a taxable person acting as such and that status is reviewed",
    "service is explicitly reviewed as GENERAL_SERVICE",
    "reviewed exclusion screen confirms no special place-of-supply rule applies",
    "recipient business establishment country is evidenced and has no relevant receiving fixed establishment, otherwise escalate",
    "tax point is supplied externally; engine only uses supplied transaction date"
  ],
  "human_review_required": true,
  "interpretation": "Article 44 applies as a general rule to services supplied to a taxable person acting as such. Its text contains business-establishment and receiving fixed-establishment branches. The candidate is therefore restricted to cases where a reviewer expressly records that no relevant recipient fixed establishment changes the receiving location. It does not resolve fixed establishment. Article 47 and other specific rules are screened out by explicit service classification and special-rule review. Hungarian NAV guidance supports the corresponding Article 37(1) domestic general rule. The exact current NJT primary text was not directly retrievable in this run, and is recorded unverified.",
  "jurisdiction": [
    "EU",
    "HU"
  ],
  "official_guidance": [
    "eu-commission-place-of-taxation",
    "hu-nav-2026-place-of-supply-instructions"
  ],
  "primary_sources": [
    "eu-vat-services-directive-2008-8",
    "eu-vat-directive-current-consolidation-2025-04-14"
  ],
  "question": "Revalidate the narrow Article 44 general B2B place-of-supply rule for a reviewed HU supplier and reviewed EU business recipient.",
  "relevant_provisions": [
    {
      "applicability_notes": "Establishes effective start for Articles 44-45.",
      "article": "Article 2",
      "paragraph": null,
      "provision": "Article 2",
      "source_id": "eu-vat-services-directive-2008-8",
      "summary": "Article 2 states the general service rule amendments apply from 2010-01-01.",
      "verified": true,
      "version_date": "2008-02-12"
    },
    {
      "applicability_notes": "Current consolidated wording; exact fixed-establishment selection is deliberately excluded from candidate and escalated.",
      "article": "Article 44",
      "paragraph": null,
      "provision": "Article 44",
      "source_id": "eu-vat-directive-current-consolidation-2025-04-14",
      "summary": "B2B recipient acting as taxable person; customer business seat, but relevant recipient fixed establishment or fallback domicile can determine place.",
      "verified": true,
      "version_date": "2025-04-14"
    },
    {
      "applicability_notes": "Requires status and acting-capacity review.",
      "article": "Article 43",
      "paragraph": null,
      "provision": "Article 43",
      "source_id": "eu-vat-directive-current-consolidation-2025-04-14",
      "summary": "Definitions for place-of-supply customer taxable-person status include non-taxable legal persons registered for VAT.",
      "verified": true,
      "version_date": "2025-04-14"
    },
    {
      "applicability_notes": "Guidance only; classification/exclusion screen must be explicitly reviewed.",
      "article": "Article 44",
      "paragraph": null,
      "provision": "Article 44",
      "source_id": "eu-commission-place-of-taxation",
      "summary": "Commission identifies Article 44 as basic B2B rule and explains service nature/status and multiple exceptions matter.",
      "verified": true,
      "version_date": "2026-10-08"
    },
    {
      "applicability_notes": "Current Hungarian official administrative confirmation; not primary law.",
      "article": "Article 37(1)",
      "paragraph": null,
      "provision": "Article 37(1)",
      "source_id": "hu-nav-2026-place-of-supply-instructions",
      "summary": "NAV filing instructions state general B2B place is customer economic establishment.",
      "verified": true,
      "version_date": "2026-01-01"
    },
    {
      "applicability_notes": "Direct NJT page timed out; this material is not relied on as verified primary evidence.",
      "article": "Article 37(1)",
      "paragraph": null,
      "provision": "Article 37(1)",
      "source_id": "hu-vat-act-2007-cxxvii",
      "summary": "NJT indexed excerpt states the domestic B2B general rule.",
      "verified": false,
      "version_date": null
    }
  ],
  "research_id": "research-81efbc33abe0d0b310eb",
  "secondary_sources": [],
  "snapshot_hash": "f4092040f89a8a28b50614282bc272d44e9d9dda34e48ff361bbfbbc1cb8c3a4",
  "snapshot_schema_version": "1.3.0",
  "sources_considered": [
    {
      "authority_level": "primary",
      "effective_from": "2010-01-01",
      "effective_to": null,
      "official_url": "https://eur-lex.europa.eu/legal-content/EN/ALL/?uri=CELEX:32008L0008",
      "publication_date": "2008-02-12",
      "retrieved_at": "2026-10-08",
      "source_id": "eu-vat-services-directive-2008-8",
      "source_type": "eu_legislation",
      "title": "Council Directive 2008/8/EC as regards place of supply of services",
      "verification": {
        "applicability_verified": false,
        "checked_at": null,
        "content_accessed": true,
        "content_verified": true,
        "effective_date_verified": true,
        "notes": "Verification status is derived from the source registry; the research draft cannot self-attest.",
        "state": "EFFECTIVE_DATE_VERIFIED",
        "url_reachable": true
      },
      "version_date": "2008-02-12"
    },
    {
      "authority_level": "primary",
      "effective_from": null,
      "effective_to": null,
      "official_url": "https://eur-lex.europa.eu/legal-content/EN/TXT/?uri=CELEX:02006L0112-20250414",
      "publication_date": null,
      "retrieved_at": "2026-10-08",
      "source_id": "eu-vat-directive-current-consolidation-2025-04-14",
      "source_type": "eu_legislation",
      "title": "Directive 2006/112/EC consolidated text dated 2025-04-14",
      "verification": {
        "applicability_verified": false,
        "checked_at": null,
        "content_accessed": true,
        "content_verified": true,
        "effective_date_verified": false,
        "notes": "Verification status is derived from the source registry; the research draft cannot self-attest.",
        "state": "CONTENT_VERIFIED",
        "url_reachable": true
      },
      "version_date": "2025-04-14"
    },
    {
      "authority_level": "official_guidance",
      "effective_from": null,
      "effective_to": null,
      "official_url": "https://taxation-customs.ec.europa.eu/taxation/vat/vat-directive/place-taxation_en",
      "publication_date": null,
      "retrieved_at": "2026-10-08",
      "source_id": "eu-commission-place-of-taxation",
      "source_type": "commission_guidance",
      "title": "Place of taxation",
      "verification": {
        "applicability_verified": false,
        "checked_at": null,
        "content_accessed": true,
        "content_verified": true,
        "effective_date_verified": false,
        "notes": "Verification status is derived from the source registry; the research draft cannot self-attest.",
        "state": "CONTENT_VERIFIED",
        "url_reachable": true
      },
      "version_date": null
    },
    {
      "authority_level": "official_guidance",
      "effective_from": null,
      "effective_to": null,
      "official_url": "https://nav.gov.hu/pfile/file?path=%2Fnyomtatvanyok%2Fletoltesek%2Fnyomtatvanykitolto_programok%2Fnyomtatvanykitolto_programok_nav%2F26A60%2Fkitoltesi-utmutato",
      "publication_date": null,
      "retrieved_at": "2026-10-08",
      "source_id": "hu-nav-2026-place-of-supply-instructions",
      "source_type": "nav_guidance",
      "title": "26A60 filing instructions: place of supply of services",
      "verification": {
        "applicability_verified": false,
        "checked_at": null,
        "content_accessed": true,
        "content_verified": true,
        "effective_date_verified": false,
        "notes": "Verification status is derived from the source registry; the research draft cannot self-attest.",
        "state": "CONTENT_VERIFIED",
        "url_reachable": true
      },
      "version_date": null
    },
    {
      "authority_level": "primary",
      "effective_from": null,
      "effective_to": null,
      "official_url": "https://njt.hu/jogszabaly/2007-127-00-00",
      "publication_date": "2007-11-16",
      "retrieved_at": "2026-10-08",
      "source_id": "hu-vat-act-2007-cxxvii",
      "source_type": "primary_legislation",
      "title": "2007. évi CXXVII. törvény az általános forgalmi adóról",
      "verification": {
        "applicability_verified": false,
        "checked_at": null,
        "content_accessed": false,
        "content_verified": false,
        "effective_date_verified": false,
        "notes": "Verification status is derived from the source registry; the research draft cannot self-attest.",
        "state": "DISCOVERED",
        "url_reachable": false
      },
      "version_date": null
    }
  ],
  "topics": [
    "place_of_supply"
  ],
  "transaction_date": "2026-10-08",
  "uncertainties": []
}
