{
  "as_of_date": "2026-10-08",
  "candidate_conclusion": "Article 45 is the general B2C service rule subject to exceptions.",
  "confidence": "low",
  "confidence_basis": [
    "Confidence is recomputed from frozen source and provision metadata; submitted rating is ignored."
  ],
  "conflicting_sources": [],
  "court_sources": [],
  "facts": {
    "case": "synthetic research scope; not a taxpayer case"
  },
  "facts_required": [
    "customer non-taxable-person status",
    "supplier establishment",
    "service category",
    "special place rules"
  ],
  "human_review_required": true,
  "interpretation": "Article 45 is the general B2C service rule subject to exceptions.",
  "jurisdiction": [
    "EU",
    "HU"
  ],
  "official_guidance": [
    "eu-commission-place-of-taxation"
  ],
  "primary_sources": [
    "eu-vat-services-directive-2008-8",
    "eu-vat-directive-current-consolidation-2025-04-14"
  ],
  "question": "What is the general place-of-supply rule for B2C services?",
  "relevant_provisions": [
    {
      "applicability_notes": "Identifies relevant text only; issue-specific application remains subject to review.",
      "article": "45",
      "paragraph": null,
      "provision": "Article 2; effective 2010-01-01, introducing Directive 2006/112/EC Article 45",
      "source_id": "eu-vat-services-directive-2008-8",
      "summary": "Directive amendment and stated application date",
      "verified": true,
      "version_date": "2008-02-12"
    },
    {
      "applicability_notes": "Identifies relevant text only; issue-specific application remains subject to review.",
      "article": "45",
      "paragraph": null,
      "provision": "Article 45",
      "source_id": "eu-vat-directive-current-consolidation-2025-04-14",
      "summary": "General B2C service place-of-supply provision",
      "verified": true,
      "version_date": "2025-04-14"
    },
    {
      "applicability_notes": "Identifies relevant text only; issue-specific application remains subject to review.",
      "article": "45",
      "paragraph": null,
      "provision": "Commission summary of Directive Article 45",
      "source_id": "eu-commission-place-of-taxation",
      "summary": "Commission summary of the general B2C rule",
      "verified": true,
      "version_date": null
    }
  ],
  "research_id": "research-80fa2af61030e5708851",
  "secondary_sources": [],
  "snapshot_hash": "92c44746744c8980da4487cb152a3ad5b950d128fc299cae6cd7813f15c846db",
  "snapshot_schema_version": "1.3.0",
  "sources_considered": [
    {
      "authority_level": "primary",
      "effective_from": "2010-01-01",
      "effective_to": null,
      "official_url": "https://eur-lex.europa.eu/legal-content/EN/ALL/?uri=CELEX:32008L0008",
      "publication_date": "2008-02-12",
      "retrieved_at": "2026-10-08",
      "source_id": "eu-vat-services-directive-2008-8",
      "source_type": "eu_legislation",
      "title": "Council Directive 2008/8/EC as regards place of supply of services",
      "verification": {
        "applicability_verified": false,
        "checked_at": null,
        "content_accessed": true,
        "content_verified": true,
        "effective_date_verified": true,
        "notes": "Verification status is derived from the source registry; the research draft cannot self-attest.",
        "state": "EFFECTIVE_DATE_VERIFIED",
        "url_reachable": true
      },
      "version_date": "2008-02-12"
    },
    {
      "authority_level": "primary",
      "effective_from": null,
      "effective_to": null,
      "official_url": "https://eur-lex.europa.eu/legal-content/EN/TXT/?uri=CELEX:02006L0112-20250414",
      "publication_date": null,
      "retrieved_at": "2026-10-08",
      "source_id": "eu-vat-directive-current-consolidation-2025-04-14",
      "source_type": "eu_legislation",
      "title": "Directive 2006/112/EC consolidated text dated 2025-04-14",
      "verification": {
        "applicability_verified": false,
        "checked_at": null,
        "content_accessed": true,
        "content_verified": true,
        "effective_date_verified": false,
        "notes": "Verification status is derived from the source registry; the research draft cannot self-attest.",
        "state": "CONTENT_VERIFIED",
        "url_reachable": true
      },
      "version_date": "2025-04-14"
    },
    {
      "authority_level": "official_guidance",
      "effective_from": null,
      "effective_to": null,
      "official_url": "https://taxation-customs.ec.europa.eu/taxation/vat/vat-directive/place-taxation_en",
      "publication_date": null,
      "retrieved_at": "2026-10-08",
      "source_id": "eu-commission-place-of-taxation",
      "source_type": "commission_guidance",
      "title": "Place of taxation",
      "verification": {
        "applicability_verified": false,
        "checked_at": null,
        "content_accessed": true,
        "content_verified": true,
        "effective_date_verified": false,
        "notes": "Verification status is derived from the source registry; the research draft cannot self-attest.",
        "state": "CONTENT_VERIFIED",
        "url_reachable": true
      },
      "version_date": null
    }
  ],
  "topics": [
    "vat",
    "article45-general-b2c"
  ],
  "transaction_date": "2026-10-08",
  "uncertainties": [
    "Special place rules may displace the general rule; exact service characteristics are necessary."
  ]
}
