{
  "as_of_date": "2026-10-08",
  "candidate_conclusion": "Non-executable candidate may be prepared for review; no legal output is issued.",
  "confidence": "low",
  "confidence_basis": [
    "Official primary and/or NAV source material accessed 2026-10-08.",
    "Unresolved applicability and future amendments prevent operational reliance."
  ],
  "conflicting_sources": [],
  "court_sources": [],
  "facts": {
    "purpose": "non-executable research only",
    "synthetic": true
  },
  "facts_required": [
    "supplier/customer status and establishment",
    "approved upstream stage and transaction date",
    "supplier/customer VAT ID status where material",
    "special rule, exemption and fixed establishment facts"
  ],
  "human_review_required": true,
  "interpretation": "Directive Articles 262(1)(c) and 264 cover specified services for which recipient liability follows Article 196, which are not exempt in the taxing Member State, and required VAT-ID information. Article 44 alone does not establish reporting duty.",
  "jurisdiction": [
    "EU",
    "HU"
  ],
  "official_guidance": [],
  "primary_sources": [
    "eu-vat-directive-2025-04-operational"
  ],
  "question": "Phase 5 research: eu-recap for synthetic Hungarian SaaS-like service scenarios",
  "relevant_provisions": [
    {
      "applicability_notes": "Transaction-specific applicability remains unverified.",
      "provision": "Article 262(1)(c)",
      "source_id": "eu-vat-directive-2025-04-operational",
      "summary": "Official source provision accessed; short summary only.",
      "verified": true,
      "version_date": "2025-04-14"
    },
    {
      "applicability_notes": "Transaction-specific applicability remains unverified.",
      "provision": "Article 263",
      "source_id": "eu-vat-directive-2025-04-operational",
      "summary": "Official source provision accessed; short summary only.",
      "verified": true,
      "version_date": "2025-04-14"
    },
    {
      "applicability_notes": "Transaction-specific applicability remains unverified.",
      "provision": "Article 264",
      "source_id": "eu-vat-directive-2025-04-operational",
      "summary": "Official source provision accessed; short summary only.",
      "verified": true,
      "version_date": "2025-04-14"
    }
  ],
  "research_id": "research-d3bec51e681633b64e54",
  "secondary_sources": [],
  "snapshot_hash": "c4a005b93dba9edc14461cdea3b0c0ee6cd39a374020d295fb40e579db109394",
  "snapshot_schema_version": "1.3.0",
  "sources_considered": [
    {
      "authority_level": "primary",
      "effective_from": "2007-01-01",
      "effective_to": null,
      "official_url": "https://eur-lex.europa.eu/legal-content/EN/TXT/?uri=CELEX:02006L0112-20250414",
      "publication_date": "2006-11-28",
      "retrieved_at": "2026-10-08",
      "source_id": "eu-vat-directive-2025-04-operational",
      "source_type": "eu_legislation",
      "title": "Council Directive 2006/112/EC consolidated text — 2025-04-14 version, operational provisions",
      "verification": {
        "applicability_verified": false,
        "checked_at": null,
        "content_accessed": true,
        "content_verified": true,
        "effective_date_verified": false,
        "notes": "Verification status is derived from the source registry; the research draft cannot self-attest.",
        "state": "CONTENT_VERIFIED",
        "url_reachable": true
      },
      "version_date": "2025-04-14"
    }
  ],
  "topics": [
    "VAT",
    "Phase5",
    "eu-recap"
  ],
  "transaction_date": "2026-10-08",
  "uncertainties": [
    "Applicability and exceptions require transaction-specific review.",
    "No new rule has human approval; this research cannot produce a tax conclusion.",
    "2025/516 future changes and member-state implementation require date-specific review."
  ]
}
